n,Header,Feature,synonyms,en,uri,super,comment,definition
CPS.3.7,,Capture Guidelines and Standards from External Sources,Capture Guidelines and Standards from External Sources,CPS.3.7 Capture Guidelines and Standards from External Sources,EhrSfmCaptureGuidelinesAndStandardsFromExternalSources,EhrSfmSupportClinicalDocumentation,Capture practice guidance from a variety of “trusted” external sources.,"Capture and import information provided by external health care organizations as relates to clinical practice guidelines (CPGs). External healthcare organizations in this function include, but are not limited to Patient management systems, Healthcare delivery organizations, Population health/surveillance organizations (e.g., local, regional, national and global Public Health services, PAHO, WHO), and professional, governmental, or industrial healthcare optimization initiatives."
CPS.3.8,,Manage Documentation of Clinician Response to Decision Support Prompts,Manage Documentation of Clinician Response to Decision Support Prompts,CPS.3.8 Manage Documentation of Clinician Response to Decision Support Prompts,EhrSfmManageDocumentationOfClinicianResponseToDecisionSupportPrompts,EhrSfmSupportClinicalDocumentation,Capture the decision support prompts and manage provider actions to accept or override decision support  prompts.,"Provider actions in response to prompts offered from decision support are captured. Management of these actions be accomplished at the patient level or aggregated for patient population, research protocol, or organizational trending."
CPS.3.9,,Clinical Decision Support System Guidelines Updates,Clinical Decision Support System Guidelines Updates,CPS.3.9 Clinical Decision Support System Guidelines Updates,EhrSfmClinicalDecisionSupportSystemGuidelinesUpdates,EhrSfmSupportClinicalDocumentation,Capture and maintain updates of clinical decision support system guidelines and associated reference material.,"System content such as discharge instructions, clinical guidelines, formularies, and other knowledge bases should be capable of being maintained and updated, independent of a particular encounter. Clinical decision support rules may be applied to the system using a manual process. As standards are developed to represent these rules, an automated update will be recommended. Any process to update decision support rules should include the verification of the appropriateness of the rules to the system. This may include but not be limited to authenticity of the source, the currency of the version, and any necessary approvals before updates can take place."
CPS.3.10,,Support for Identification of Potential Problems and Trends,Support for Identification of Potential Problems and Trends,CPS.3.10 Support for Identification of Potential Problems and Trends,EhrSfmSupportForIdentificationOfPotentialProblemsAndTrends,EhrSfmSupportClinicalDocumentation,"Identify conditions of clinical interest, identify trends that may lead to significant problems, and provide prompts for clinical decision support.","Providing the health care provider with a prompt, notification or alert for identified specific concerns of clinical interest is a cornerstone of Clinical Decision Support. When personal health information is collected directly during a patient visit, input by the patient, or acquired from an external source (laboratory results), it is important to be able to identify and tag potential problems and trends that may be condition- or patient-specific (given the individual's personal health profile), or changes warranting further assessment."
CPS.3.11,,Support Other Encounter and Episode of Care Documentation,Support Other Encounter and Episode of Care Documentation,CPS.3.11 Support Other Encounter and Episode of Care Documentation,EhrSfmSupportOtherEncounterAndEpisodeOfCareDocumentation,EhrSfmSupportClinicalDocumentation,"Where not covered above, provide the means to manage and organize the documentation of the health care needed and delivered during an encounter/episode of care.","Using data standards and technologies that support interoperability, effective documentation of an encounter can promote patient- centered/oriented care and enables real-time, immediate point-of-service care delivery. Effective encounter and episode-of-care documentation can facilitate efficient work flow and improve operations performance. This can help to ensure the integrity of (1) the health record, (2) public health, financial and administrative reporting, and (3) the healthcare delivery process."
CPS.3.12,,Manage Health Information Record Quality,Manage Health Information Record Quality,CPS.3.12 Manage Health Information Record Quality,EhrSfmManageHealthInformationRecordQuality,EhrSfmSupportClinicalDocumentation,"Support grammatical and lexical integrity of the health record by providing medical spelling, thesaurus and grammar ready assistance during clinical documentation as well as enabling shortcuts for pre-defined text.","Users and patients will benefit from features that enable rapid checking of spelling and grammar, a medical thesaurus function as well as text shortcuts to expand pre-defined text during clinical documentation. A shortcut may also be defined to trigger a specific system function such as the opening of a pre-defined template. These functions may be defined at an enterprise level based on scope of practice, organizational policy, and/or jurisdictional law. However, pre-defined text may also be configured by provider or provider type."
CPS.4,Support Orders,,Support Orders,CPS.4 Support Orders,EhrSfmSupportOrders,EhrSfmCareProvisionSupport,Support for Orders is required to ensure that appropriate decision support and safety checks are conducted by the system at the time of ordering as well as at the time of dispensing medications or immunizations.,"Support for orders includes the management of order set templates, the support for specific types of orders including medication, immunization, non-medication, diagnostic tests as well as blood products and biologicals.Decision Support for orders includes checking for allergies or adverse interactions, dosing checking and issuing the appropriate warnings. It may also include functions to increase ordering efficiency such as verifying all necessary information to fulfill the order is captured and making recommendations for supporting orders.A component of ordering medications and immunizations is the dispensing of those orders and, where applicable, this function will include criteria to support dispensing. Note: Administration of Orders is included in CPS.6 (Support for Treatment Administration)."
CPS.4.1,,Manage Order Set Templates,Manage Order Set Templates,CPS.4.1 Manage Order Set Templates,EhrSfmManageOrderSetTemplates,EhrSfmSupportOrders,"Maintain order set templates based on preferred standards, provider preferences, organizational policy or other criteria.","Order set templates, which may include medication orders, allow a care provider to choose common orders for a particular circumstance or disease state according to standards (e.g., best practice guidelines) or other criteria. Order Set Templates may be defined to allow or not allow the provider to modify (add/remove/update) specific orders when applying them to a specific patient."
CPS.4.2,,Support Medication and Immunization Ordering,Support Medication and Immunization Ordering,CPS.4.2 Support Medication and Immunization Ordering,EhrSfmSupportMedicationAndImmunizationOrdering,EhrSfmSupportOrders,"Provide functionality to alert providers to potential medication and immunization ordering errors (such as wrong patient, wrong drug, wrong dose, wrong route and wrong time).","During medication or immunization ordering it is critical to minimize potential errors that can cause adverse events. This is accomplished by the EHR system through the use of clinical decision support and prompting to validate the order at time of ordering. Whist many of these functions are more commonly associated with medication ordering; they also apply to ordering of immunizations when such ordering occurs. The support includes the checking for drug/drug interactions, checking against documented allergies or previous adverse events as well as validating patient-specific dosing and providing appropriate warnings. support for medial ordering efficiencies also ensures that orders are appropriate and contain all required supporting information."
CPS.4.2.1,,Support for Medication Interaction and Allergy Checking,Support for Medication Interaction and Allergy Checking,CPS.4.2.1 Support for Medication Interaction and Allergy Checking,EhrSfmSupportForMedicationInteractionAndAllergyChecking,EhrSfmSupportOrders,"Identify medication interaction warnings at the time of medication or immunization ordering, or prescribing, as well as at the time of dispensing.","The clinician is alerted to medication-medication, medication-allergy, medication-food, medication-supplement (herbal or dietary) interactions at levels appropriate to the health care setting and with respect to the patient condition. These alerts may be customized to suit the user or group.Note, medication may be affected by food or diatary choices; whist this is not considered an interaction it is consequently not included in this function; however, the provision of drug-food effectiveness in information to be provided to the patient is included in the function CP.8.1 (Generate, Record and Distribute Patient-Specific Instructions).If the patient’s condition is one where, in order to view the necessary components of the health record, patient authorization or consent is required; then the system should show the medication but mask the condition for which the medication is prescribed until the required consent or authorization is available. In an emergent situation, where all health information is required to provide the most effective treatment, and it is not possible to obtain an authorization or consent; the system should provide an override (e.g., ""break the glass"") function to allow access to the diagnosis or problem for which a medication was ordered, according to scope of practice, organizational policies, and/or jurisdictional law."
CPS.4.2.2,,Support of patient- specific Dosing and Warnings,Support of patient- specific Dosing and Warnings,CPS.4.2.2 Support of patient- specific Dosing and Warnings,EhrSfmSupportOfPatientSpecificDosingAndWarnings,EhrSfmSupportOrders,Identify and present appropriate dose recommendations based on known patient conditions and characteristics at the time of medication ordering and dispensing.,"The clinician is alerted to patient-specific contraindications and warnings e.g., pregnancy, breast-feeding or occupational risks, hepatic or renal insufficiency. The preferences of the patient may also be presented (e.g., reluctance to use an antibiotic). Additional patient parameters, such as age, gestation, genetic disposition, height, weight, and Body Surface Area (BSA), shall also be incorporated."
CPS.4.2.3,,Support for Medication Ordering Efficiencies,Support for Medication Ordering Efficiencies,CPS.4.2.3 Support for Medication Ordering Efficiencies,EhrSfmSupportForMedicationOrderingEfficiencies,EhrSfmSupportOrders,Provide the tooling necessary to support efficient medication ordering.,"Support efficient medication ordering workflows by allowing medications to be sorted and reviewed by key attributes, e.g., generic or trade names. Also support editing medication orders across multiple instances of an order and capturing medication orders in order sets."
CPS.4.2.4,,Support for Medication Recommendations,Support for Medication Recommendations,CPS.4.2.4 Support for Medication Recommendations,EhrSfmSupportForMedicationRecommendations,EhrSfmSupportOrders,"Offer recommendations and options in medication treatment protocols as well as supporting medication monitoring on the basis of patient diagnosis, patient characteristics, or therapeutic guidelines and protocols.","The system should list medication treatment options on the basis of practice standards and the patient's conditions, diagnoses and characteristics (e.g., obesity, occupation). The system may also provide prompts and notifications to support medication monitoring."
CPS.4.2.5,,Support for Medication Reconciliation,Support for Medication Reconciliation,CPS.4.2.5 Support for Medication Reconciliation,EhrSfmSupportForMedicationReconciliation,EhrSfmSupportOrders,Review a patient’s medication information (from more than one source) and reconcile conflicts.,"Medication reconciliation is the process of comparing a patient's medication information (from all sources) to the medications that the patient is actually has been taking. Medication reconciliation is done to avoid medication errors such as omissions, duplications, dosing errors, or drug interactions. Medication Reconciliation should be done at every episode or transition of care in which new medications are ordered or administered, existing orders are rewritten or where medications may influence the care given.Transitions in care include changes in setting, service, practitioner, or level of care. The Medication Reconciliation process comprises five includes several steps: (1) develop a list of current medication list of medications that the patient is taking, (2) develop a list of medications to be prescribed or recommended (3) compare the medication information from all sources; (4) make shared and informed clinical decisions based on the comparison and provide the ability to document the interaction; and (5) communicate the updated medication information to the healthcare teams, the patient and appropriate caregivers. For example: If a patient’s pain, anticoagulation, hyperglycemia or other high risk therapy is being managed by a specialist, the healthcare team must be aware to avoid prescribing an additional equivalent of this medication.(6) Verify the patient’s/caregiver’s understanding and agreement to the patient’s medication treatment plan.(7) Standardization of shared medication information (name, dose, instructions, indications, prescriber, etc)"
CPS.4.3,,Support for Non- Medication Ordering,Support for Non- Medication Ordering,CPS.4.3 Support for Non- Medication Ordering,EhrSfmSupportForNonMedicationOrdering,EhrSfmSupportOrders,"Facilitate provider review and validation of order information to make it pertinent, effective and resource-conservative at the point of order entry.","The system assists provider during order entry for therapies, treatments, care, diagnostics and medical supplies and equipment. Support includes, for example: alerts to duplicate orders, missing results or other information required to initiate order, suggested corollary orders, order sets, best practice guidelines, institution-specific order guidelines and patient diagnosis specific recommendations. Also alerts for orders that may be inappropriate or contraindicated for specific patients, for example, X-rays on pregnant women."
CPS.4.4,,Support Orders for Diagnostic/Screening Tests,Support Orders for Diagnostic/Screening Tests,CPS.4.4 Support Orders for Diagnostic/Screening Tests,EhrSfmSupportOrdersForDiagnosticscreeningTests,EhrSfmSupportOrders,This function has not been defined and is captured here as a place-holder for potential further development of the Functional Model and to maintain alignment with the corresponding CP section.,None Defined at this time.
CPS.4.5,,Support Orders for Blood Products and Other Biologics,Support Orders for Blood Products and Other Biologics,CPS.4.5 Support Orders for Blood Products and Other Biologics,EhrSfmSupportOrdersForBloodProductsAndOtherBiologics,EhrSfmSupportOrders,This function has not been defined and is captured here as a place-holder for potential further development of the Functional Model and to maintain alignment with the corresponding CP section.,None Defined at this time.
CPS.4.6,Support for Referrals,,Support for Referrals,CPS.4.6 Support for Referrals,EhrSfmSupportForReferrals,EhrSfmSupportOrders,Evaluate patient information for referral indicators.,"The system assists with patient referrals, including prompting the provider with referral recommendations based on the patient's medical record. When creating the referral order, support is provided in the compilation of relevant clinical and behavioral health results, demographic and insurance information (if available). Standardized or evidence based protocols for workup prior to referral may also be presented."
CPS.4.6.1,,Support for Referral Process,Support for Referral Process,CPS.4.6.1 Support for Referral Process,EhrSfmSupportForReferralProcess,EhrSfmSupportOrders,Evaluate referrals within the context of a patient’s healthcare data.,"The system assists with patient referrals, including compilation of relevant clinical and behavioral health results, demographic and insurance information (if available). Standardized or evidence based protocols for workup prior to referral may also be presented."
CPS.4.6.2,,Support for Referral Recommendations,Support for Referral Recommendations,CPS.4.6.2 Support for Referral Recommendations,EhrSfmSupportForReferralRecommendations,EhrSfmSupportOrders,Evaluate patient data and recommend patient referral based on specific criteria.,"The system assists evaluation of certain patient conditions which may lead to a recommendation for referral, for example, for smoking cessation counseling if the patient is prescribed a medication to support cessation screening or assessment for behavioral health conditions. Additionally the system may present recommendations based on other orders – for example, an order for Adriamycin, where additional testing such as a MUGA (heart) scan or an Echocardiogram should be completed prior to administration, could result in a recommended referral to radiology, and/or cardiology."
CPS.4.6.3,,Support for Electronic Referral Ordering,Support for Electronic Referral Ordering,CPS.4.6.3 Support for Electronic Referral Ordering,EhrSfmSupportForElectronicReferralOrdering,EhrSfmSupportOrders,Enable the transmission of electronic referral orders from the EHR-S.,"When a referral order is created in the system, the system should have the ability to compose the referral package, including any supporting clinical and administrative information, and transmit the referral order to the referred-to provider electronically."
CPS.5,,Support for Results,Support for Results,CPS.5 Support for Results,EhrSfmSupportForResults,EhrSfmCareProvisionSupport,Evaluate results and notify provider and patient of results within the context of the patient’s healthcare data.,"The system suggests result interpretations and notifications including those for, abnormal results, trending of results (such as discrete laboratory values over time), evaluation of pertinent results at the time of provider order entry (such as evaluation of laboratory results at the time of ordering a radiology exam), evaluation of incoming results against active medication orders."
CPS.6,Support Treatment Administration,,Support Treatment Administration,CPS.6 Support Treatment Administration,EhrSfmSupportTreatmentAdministration,EhrSfmCareProvisionSupport,"Alert providers to potential administration errors (such as wrong patient, wrong drug, wrong dose, wrong route and wrong time) in support of safe and accurate medication and immunization administration and support administration workflow.","The system promotes the reduction of errors at time of administration and at the point of care by positive patient identification, by checks on drug identification including name, dose, route and designated time of administration. Access to drug monograph information may be provided to allow providers to check details about a drug and enhance patient education. Workflow for administration is supported through prompts and reminders regarding the “window” for timely administration of medications and immunizations."
CPS.6.1,,Support for Medication Administration,Support for Medication Administration,CPS.6.1 Support for Medication Administration,EhrSfmSupportForMedicationAdministration,EhrSfmSupportTreatmentAdministration,"Alert providers to potential administration errors (such as wrong patient, wrong drug, wrong dose, wrong route and wrong time) in support of safe and accurate medication administration and support medication administration workflow.","The system promotes the reduction of medication errors at time of administration and at the point of care by positive patient identification, by checks on drug identification including name, dose, route and designated time of administration. Access to drug monograph information may be provided to allow providers to check details about a drug and enhance patient education. Medication administration includes the administration of medication therapies such as chemotherapy. Workflow for medication administration is supported through prompts and reminders regarding the “window” for timely administration of medications."
CPS.6.2,,Support for Immunization Administration,Support for Immunization Administration,CPS.6.2 Support for Immunization Administration,EhrSfmSupportForImmunizationAdministration,EhrSfmSupportTreatmentAdministration,"Alert providers to potential administration errors (such as wrong patient, wrong drug, wrong dose, wrong route and wrong schedule) in support of safe and accurate immunization administration and support immunization administration workflow.",The system assists in reduction of medication errors at time of administration by positive patient identification and by checks on immunization identification. Workflow for immunization administration is supported through prompts and reminders regarding the “window” for timely administration of immunizations.
CPS.6.3,,Support for Safe Blood Administration,Support for Safe Blood Administration,CPS.6.3 Support for Safe Blood Administration,EhrSfmSupportForSafeBloodAdministration,EhrSfmSupportTreatmentAdministration,Facilitate real-time checks for potential blood administration errors.,"To reduce errors at the time of blood product administration, the system assists in positive patient identification, along with checks and alerts regarding the blood product to be administered, including the identification of the blood product, the amount to be delivered, and the route and time of the administration of the blood product."
CPS.6.4,,Support for Accurate Specimen Collection,Support for Accurate Specimen Collection,CPS.6.4 Support for Accurate Specimen Collection,EhrSfmSupportForAccurateSpecimenCollection,EhrSfmSupportTreatmentAdministration,Facilitate real-time checks to ensure accurate specimen collection.,"To ensure specimen collection accuracy, the patient and specimen are positively identified. The provider is notified in real-time of potential collection errors such as wrong patient, wrong specimen type, wrong means of collection, wrong site, and wrong date and time."
CPS.7,Support Future Care,,Support Future Care,CPS.7 Support Future Care,EhrSfmSupportFutureCare,EhrSfmCareProvisionSupport,Support for Future Care is necessary to enable the planning of future care according to appropriate healthcare guidelines.,Support for future care includes the provision of clinical decision support through giving access to healthcare guidelines from external sources.
CPS.7.1,,Access Healthcare Guidance,Access Healthcare Guidance,CPS.7.1 Access Healthcare Guidance,EhrSfmAccessHealthcareGuidance,EhrSfmSupportFutureCare,"Provide pertinent information from available evidence-based knowledge, at the point of care, for use in healthcare decisions and care planning.","The information available regarding disease, disease processes, diagnostic testing, pharmaceuticals, treatment patterns and all aspects of healthcare is constantly changing. The practitioner should be able to access a wide variety of sources that provide relevant, accurate information about any given subject. Examples of resources include, but are not limited to evidence on treatment of specific medical conditions, maintenance of wellness, drug or device trials, context-specific information available through online journals, printed resources such as books and specialty organizations resources. For example, when a condition is diagnosed the provider might be directed to relevant resources that give updated clinical research, useful pharmaceutical combinations, surgical techniques, products or other information useful in the management of the specific condition under consideration."
CPS.8,Support Patient Education & Communication,,Support Patient Education & Communication,CPS.8 Support Patient Education & Communication,EhrSfmSupportPatientEducationCommunication,EhrSfmCareProvisionSupport,Support for appropriate communication with the patient or the patient representatives.,"Support for patient education and communication is critical to ensure that the patient can appropriately participate in his care. This includes providing access to relevant patient educational materials and reminders from internal, and/or external sources."
