n,Header,Feature,synonyms,en,uri,super,comment,definition
RI.1.1.2,,Amend Record Entry Content,Amend Record Entry Content,RI.1.1.2 Amend Record Entry Content,EhrSfmAmendRecordEntryContent,EhrSfmRecordLifecycle,Amend content of a Record Entry (1 instance),"Occurs when Record Entry content is modified (from its original or previously retained state) – typically upon conclusion of an Action, to correct, update or complete content.- Amended Record Entry content is the responsibility of authorized amendment Author(s).- The amendment becomes part of the Act Record revision history, where the original content and any previous amendments are retained without alteration.- After amendment, the System is responsible for retention of the Record Entry and its revision history.- An Audit Trigger is initiated to track Record Entry amendment.Reference: ISO 21089, Section 12.3.2"
RI.1.1.2.1,,Evidence of Record Entry Amendment Event,Evidence of Record Entry Amendment Event,RI.1.1.2.1 Evidence of Record Entry Amendment Event,EhrSfmEvidenceOfRecordEntryAmendmentEvent,EhrSfmAmendRecordEntryContent,Maintain Evidence of Record Entry Amendment Event,"Evidence of Record Entry Amendment Event includes key metadata, ensures health record integrity (and trust) and enables record audit."
RI.1.1.3,,Translate Record Entry Content,Translate Record Entry Content,RI.1.1.3 Translate Record Entry Content,EhrSfmTranslateRecordEntryContent,EhrSfmRecordLifecycle,Translate content of Record Entries (1 or more instances),"Occurs when Record Entries are amended to include translation of content – typically to transform coded data from one coding/classification scheme to another, also from one human language to another.- Translated (amended) Record Entry content is the responsibility of translating System – which invokesmapping/translation rules for each relevant record attribute.- The translation amendment becomes part of the Record Entry revision history, where original content andany previous amendments are retained without alteration.- After translation amendment, the System is responsible for retention of the Record Entry and its revisionhistory (including the translation event).- An Audit Trigger is initiated to track Record Entry translation.Reference: ISO 21089, Sections 12.3.2 and 12.4."
RI.1.1.3.1,,Evidence of Record Entry Translate Event,Evidence of Record Entry Translate Event,RI.1.1.3.1 Evidence of Record Entry Translate Event,EhrSfmEvidenceOfRecordEntryTranslateEvent,EhrSfmTranslateRecordEntryContent,Maintain Evidence of Record Entry Translate Event,"Evidence of Record Entry Translate Event includes key metadata, ensures health record integrity (and trust) and enables record audit."
RI.1.1.4,,Attest Record Entry Content,Attest Record Entry Content,RI.1.1.4 Attest Record Entry Content,EhrSfmAttestRecordEntryContent,EhrSfmRecordLifecycle,Attest to content of Record Entry (1 instance),"Occurs when Record Entry content is attested for accuracy and completeness – typically during/after conclusion of an Action.- Attested Record Entry content is the responsibility of Attesting Author. The Attesting Author may be someone other than the originating Author, i.e., a supervisor, proctor, preceptor or other designated individual.- An Audit Trigger is initiated to track Record Entry attestation.The purpose of attestation is to show authorship and assign responsibility for an act, event, condition, opinion, E233 or diagnosis. Every Record Entry must be identified with the author and should not be made or signed by someone other than the author unless they have authority to do so. For example, a resident may author Record Entry content but the person taking legal authority for the content is the “attester” – both individuals should be identified. (Note: A transcriptionist may transcribe an author's notes and a senior clinician may attest to the accuracy of another's statement of events.)- Author: All users who create or contribute content and have a role in the development of a Record Entry. Some entries may be created by an author whose role is a student, transcriber or scribe. -Attester: A user who takes legal authority for Record Entry content. The attester is often the same as the author, but they may also be an individual with authority to take responsibility for Record Entry content created in whole or in part by another author(s) (e.g., student, scribe, transcriptionist).Reference: ISO 21089, Section 12.2.2."
RI.1.1.4.1,,Evidence of Record Entry Attestation Event,Evidence of Record Entry Attestation Event,RI.1.1.4.1 Evidence of Record Entry Attestation Event,EhrSfmEvidenceOfRecordEntryAttestationEvent,EhrSfmAttestRecordEntryContent,Maintain Evidence of Record Entry Attestation Event,"Evidence of Record Entry Attestation Event includes key metadata, ensures health record integrity (and trust) and enables record audit."
RI.1.1.5,,View/Access Record Entry Content,View/Access Record Entry Content,RI.1.1.5 View/Access Record Entry Content,EhrSfmViewaccessRecordEntryContent,EhrSfmRecordLifecycle,View/Access content of Record Entries (1 or more instances),"Occurs when Record Entry content is viewed or accessed.- Viewed Record Entry content is the responsibility of authorized User(s).- An Audit Trigger is initiated to track Record Entry views and access.Reference: ISO 21089, Section 12.5."
RI.1.1.5.1,,Evidence of Record Entry View/Access Event,Evidence of Record Entry View/Access Event,RI.1.1.5.1 Evidence of Record Entry View/Access Event,EhrSfmEvidenceOfRecordEntryViewaccessEvent,EhrSfmViewaccessRecordEntryContent,Maintain Evidence of Record Entry View/Access Event,"Evidence of Record Entry View/Access Event includes key metadata, ensures health record integrity (and trust) and enables record audit."
RI.1.1.6,,Output/Report Record Entry Content,Output/Report Record Entry Content,RI.1.1.6 Output/Report Record Entry Content,EhrSfmOutputreportRecordEntryContent,EhrSfmRecordLifecycle,Output/Report content of Record Entries (1 or more instances),"Occurs when Record Entry content is output or reported. - Output/reported Record Entry content is the responsibility of authorized User(s). - An Audit Trigger is initiated to track Record Entry content outputs and reports. Reference: ISO 21089, Section 12.5."
RI.1.1.6.1,,Evidence of Record Entry Output/Report Event,Evidence of Record Entry Output/Report Event,RI.1.1.6.1 Evidence of Record Entry Output/Report Event,EhrSfmEvidenceOfRecordEntryOutputreportEvent,EhrSfmOutputreportRecordEntryContent,Maintain Evidence of Record Entry Output/Report Event,"Evidence of Record Entry Output/Report Event includes key metadata, ensures health record integrity (and trust) and enables record audit."
RI.1.1.7,,Disclose Record Entry Content,Disclose Record Entry Content,RI.1.1.7 Disclose Record Entry Content,EhrSfmDiscloseRecordEntryContent,EhrSfmRecordLifecycle,Disclose content of Record Entries,"Occurs when Record Entry content is disclosed according to scope of practice, organizational policy or jurisdictional law.- Disclosed Record Entry content is the responsibility of authorized User(s).- An Audit Trigger is initiated to track Record Entry content disclosures.Reference: ISO 21089, Section 12.5."
RI.1.1.7.1,,Evidence of Record Entry Disclosure Event,Evidence of Record Entry Disclosure Event,RI.1.1.7.1 Evidence of Record Entry Disclosure Event,EhrSfmEvidenceOfRecordEntryDisclosureEvent,EhrSfmDiscloseRecordEntryContent,Maintain Evidence of Record Entry Disclosure Event,"Evidence of Record Entry Disclosure Event includes key metadata, ensures health record integrity (and trust) and enables record audit."
RI.1.1.8,,Transmit Record Entry Content,Transmit Record Entry Content,RI.1.1.8 Transmit Record Entry Content,EhrSfmTransmitRecordEntryContent,EhrSfmRecordLifecycle,Transmit content of Record Entries (1 or more instances),"Occurs when Record Entry content is transmitted – typically to an external entity or system.- Transmittal may include original Record Entry content with subsequent amendment(s), if any.- Transmittal of Record Entries is the responsibility of the System – which invokes relevant rules.- An Audit Trigger is initiated to track Record Entry transmittal.Reference: ISO 21089, Section 12.8.1."
RI.1.1.8.1,,Evidence of Record Entry Transmit Event,Evidence of Record Entry Transmit Event,RI.1.1.8.1 Evidence of Record Entry Transmit Event,EhrSfmEvidenceOfRecordEntryTransmitEvent,EhrSfmTransmitRecordEntryContent,Maintain Evidence of Record Entry Transmit Event,"Evidence of Record Entry Transmit Event includes key metadata, ensures health record integrity (and trust) and enables record audit."
RI.1.1.9,,Receive and Retain Record Entries,Receive and Retain Record Entries,RI.1.1.9 Receive and Retain Record Entries,EhrSfmReceiveAndRetainRecordEntries,EhrSfmRecordLifecycle,Receive and retain/persist content of Record Entries (1 or more instances),"Occurs when Record Entry content is received – typically from an external system.- Receipt of Record Entries is the responsibility of the System – which invokes relevant rules.- An Audit Trigger is initiated to track Record Entry receipt and retention.Reference: ISO 21089, Section 12.8.1."
RI.1.1.9.1,,Evidence of Record Entry Receive/Retain Event,Evidence of Record Entry Receive/Retain Event,RI.1.1.9.1 Evidence of Record Entry Receive/Retain Event,EhrSfmEvidenceOfRecordEntryReceiveretainEvent,EhrSfmReceiveAndRetainRecordEntries,Maintain Evidence of Record Entry Receive/Retain Event,"Evidence of Record Entry Receive/Retain Event includes key metadata, ensures health record integrity (and trust) and enables record audit."
RI.1.1.10,,De-identify Record Entries,De-identify Record Entries,RI.1.1.10 De-identify Record Entries,EhrSfmDeidentifyRecordEntries,EhrSfmRecordLifecycle,De-identify content of Record Entries (1 or more instances),"Occurs when Record Entry content is transformed into de-identified version.- De-identification of Record Entries may be initiated by User command.- De-identification of Record Entries is the responsibility of the System – which invokes relevant rules.- An Audit Trigger is initiated to track Record Entry de-identification.Reference: ISO 21089, Section 12.6.1."
RI.1.1.10.1,,Evidence of Record Entry De-Identification Event,Evidence of Record Entry De-Identification Event,RI.1.1.10.1 Evidence of Record Entry De-Identification Event,EhrSfmEvidenceOfRecordEntryDeidentificationEvent,EhrSfmDeidentifyRecordEntries,Maintain Evidence of Record Entry De-Identification Event,"Evidence of Record Entry De-Identification Event includes key metadata, ensures health record integrity (and trust) and enables record audit."
RI.1.1.11,,Pseudomynize Record Entries,Pseudomynize Record Entries,RI.1.1.11 Pseudomynize Record Entries,EhrSfmPseudomynizeRecordEntries,EhrSfmRecordLifecycle,Provide pseudomynized identity for Record Entries (1 or more instances),"Occurs when Record Entry is transformed into an pseudomynized version.- Pseudomynization allows records to be later re-identified.- Pseudomynization of Record Entries may be initiated by User command.- Pseudomynization of Record Entries is the responsibility of the System – which invokes relevant rules.- An Audit Trigger is initiated to track Record Entry pseudomynization.Reference: ISO 21089, Section 12.6.1."
RI.1.1.11.1,,Evidence of Record Entry Pseudomynization Event,Evidence of Record Entry Pseudomynization Event,RI.1.1.11.1 Evidence of Record Entry Pseudomynization Event,EhrSfmEvidenceOfRecordEntryPseudomynizationEvent,EhrSfmPseudomynizeRecordEntries,Maintain Evidence of Record Entry Pseudomynization Event,"Evidence of Record Entry Pseudomynization Event includes key metadata, ensures health record integrity (and trust) and enables record audit."
RI.1.1.12,,Re-identify Record Entries,Re-identify Record Entries,RI.1.1.12 Re-identify Record Entries,EhrSfmReidentifyRecordEntries,EhrSfmRecordLifecycle,Re-identify previously aliased identity for content of Record Entries (1 or more instances),"Occurs when Record Entries are re-identified from a previously aliased version.- Re-identification of Record Entries is the responsibility of the System – which invokes relevant rules.- An Audit Trigger is initiated to track Record Entry re-identification.Reference: ISO 21089, Section 12.6.2."
RI.1.1.12.1,,Evidence of Record Entry Re-Identification Event,Evidence of Record Entry Re-Identification Event,RI.1.1.12.1 Evidence of Record Entry Re-Identification Event,EhrSfmEvidenceOfRecordEntryReidentificationEvent,EhrSfmReidentifyRecordEntries,Maintain Evidence of Record Entry Re-Identification Event,"Evidence of Record Entry Re-Identification Event includes key metadata, ensures health record integrity (and trust) and enables record audit."
RI.1.1.13,,Extract Record Entry Content,Extract Record Entry Content,RI.1.1.13 Extract Record Entry Content,EhrSfmExtractRecordEntryContent,EhrSfmRecordLifecycle,"Extract Record Entry content to produce subsets, derivations, summaries or aggregations  (Multiple instances)","Occurs when Record Entry content is extracted to render subsets, derivations, summaries or aggregations. - Extraction of Record Entry content may be initiated by User command, and/or rules-based algorithm. - Extraction of Record Entry content is the responsibility of the System – which invokes relevant rules. - An Audit Trigger is initiated to track Record Entry content extraction. Reference: ISO 21089, Section 12.7. An EHR-S enables an authorized user, such as a clinician, to access and aggregate the distributed information, which corresponds to the health record or records that are needed for viewing, reporting, disclosure, etc. An EHR-S must support data extraction operations across the complete data set that constitutes the health record of an individual and provide an output that fully chronicles the healthcare process. Data extractions are used as input to patient care coordination between facilities, organizations and settings. In addition, data extractions can be used for administrative, financial, research, quality analysis, public health purposes, and to enable re-creation of copies for importing into different EHR applications and enable the archiving of patients' data. Data may be extracted in order to meet analysis and reporting requirements. The extracted data may require use of more than one application and it may be pre-processed (for example, by being de-identified) before transmission. Data extractions may be used to exchange data and provide reports for primary and ancillary purposes."
RI.1.1.13.1,,Evidence of Record Entry Extraction Event,Evidence of Record Entry Extraction Event,RI.1.1.13.1 Evidence of Record Entry Extraction Event,EhrSfmEvidenceOfRecordEntryExtractionEvent,EhrSfmExtractRecordEntryContent,Maintain Evidence of Record Entry Extraction Event,"Evidence of Record Entry Extraction Events includes key metadata, ensures health record integrity (and trust) and enables record audit."
RI.1.1.14,,Archive Record Entries,Archive Record Entries,RI.1.1.14 Archive Record Entries,EhrSfmArchiveRecordEntries,EhrSfmRecordLifecycle,Archive Record Entries (1 or more instances),"Occurs when Record Entries are archived – typically to off-line (less readily available) storage media.- Archival of Record Entries may be initiated by User command.- Archival of Record Entries is the responsibility of the System – which invokes relevant rules.-An Audit Trigger is initiated to track Record Entry archival.Reference: ISO 21089, Section 12.10."
RI.1.1.14.1,,Evidence of Record Entry Archive Event,Evidence of Record Entry Archive Event,RI.1.1.14.1 Evidence of Record Entry Archive Event,EhrSfmEvidenceOfRecordEntryArchiveEvent,EhrSfmArchiveRecordEntries,Maintain Evidence of Record Entry Archive Event,"Evidence of Record Entry Archive Event includes key metadata, ensures health record integrity (and trust) and enables record audit."
RI.1.1.15,,Restore (previously archived) Record Entries,Restore (previously archived) Record Entries,RI.1.1.15 Restore (previously archived) Record Entries,EhrSfmRestorePreviouslyArchivedRecordEntries,EhrSfmRecordLifecycle,Restore previously archived Record Entries (1 or more instances),"Occurs when Record Entries are restored from archive. - Restore of Record Entries may be initiated by User command. - Restoration of Record Entries is the responsibility of the System – which invokes relevant rules. - An Audit Trigger is initiated to track Record Entry restoration.Reference: ISO 21089, Section 12.10."
RI.1.1.15.1,,Evidence of Record Entry Restore Event,Evidence of Record Entry Restore Event,RI.1.1.15.1 Evidence of Record Entry Restore Event,EhrSfmEvidenceOfRecordEntryRestoreEvent,EhrSfmRestorePreviouslyArchivedRecordEntries,Maintain Evidence of Record Entry Restore Event,"Evidence of Record Entry Restore Event includes key metadata, ensures health record integrity (and trust) and enables record audit."
RI.1.1.16,,Destroy or Identify Record Entries as Missing,Destroy or Identify Record Entries as Missing,RI.1.1.16 Destroy or Identify Record Entries as Missing,EhrSfmDestroyOrIdentifyRecordEntriesAsMissing,EhrSfmRecordLifecycle,Destroy or Identify Record Entries as Missing (1 or more instances),"Occurs when Record Entries are destroyed or identified as missing.- Destruction typically occurs after conclusion of the legal retention period.- Destruction of Record Entries may be initiated by User command.- Destruction of Record Entries is the responsibility of the System – which invokes relevant rules.- An Audit Trigger is initiated to track Record Entry Destruction or Notation as Missing.Reference: ISO 21089, Section 12.11."
RI.1.1.16.1,,Evidence of Record Entry Destruction Event,Evidence of Record Entry Destruction Event,RI.1.1.16.1 Evidence of Record Entry Destruction Event,EhrSfmEvidenceOfRecordEntryDestructionEvent,EhrSfmDestroyOrIdentifyRecordEntriesAsMissing,Maintain Evidence of Record Entry Destruction Event,"Evidence of Record Entry Destruction Event includes key metadata, ensures health record integrity (and trust) and enables record audit."
RI.1.1.17,,Deprecate/Retract Record Entries,Deprecate/Retract Record Entries,RI.1.1.17 Deprecate/Retract Record Entries,EhrSfmDeprecateretractRecordEntries,EhrSfmRecordLifecycle,Deprecate/retract Record Entries as invalid (1 or more instances),Occurs when Record Entries are deprecated if found to be improperly identified or otherwise invalid.- Deprecation of Record Entries may be initiated by User command.- Deprecation of Record Entries is the responsibility of the System – which invokes relevant rules.- An Audit Trigger is initiated to track Record Entry Deprecation.
RI.1.1.17.1,,Evidence of Record Entry Deprecation/Retraction Event,Evidence of Record Entry Deprecation/Retraction Event,RI.1.1.17.1 Evidence of Record Entry Deprecation/Retraction Event,EhrSfmEvidenceOfRecordEntryDeprecationretractionEvent,EhrSfmDeprecateretractRecordEntries,Maintain Evidence of Record Entry Deprecation/Retraction Event,"Evidence of Record Entry Deprecation/Retraction Event includes key metadata, ensures health record integrity (and trust) and enables record audit."
RI.1.1.18,,Re-Activate Record Entries,Re-Activate Record Entries,RI.1.1.18 Re-Activate Record Entries,EhrSfmReactivateRecordEntries,EhrSfmRecordLifecycle,Re-activate Record Entries (1 or more instances),Occurs when Record Entries are made active again after previously Destroy or Deprecate.- Re-activation of Record Entries may be initiated by User command.- Re-activation of Record Entries is the responsibility of the System – which invokes relevant rules.-An Audit Trigger is initiated to track Record Entry Re-Activation.
RI.1.1.18.1,,Evidence of Record Entry Re-Activation Event,Evidence of Record Entry Re-Activation Event,RI.1.1.18.1 Evidence of Record Entry Re-Activation Event,EhrSfmEvidenceOfRecordEntryReactivationEvent,EhrSfmReactivateRecordEntries,Maintain Evidence of Record Entry Re-Activation Event,"Evidence of Record Entry Re-Activation Event includes key metadata, ensures health record integrity (and trust) and enables record audit."
RI.1.1.19,,Merge Record Entries,Merge Record Entries,RI.1.1.19 Merge Record Entries,EhrSfmMergeRecordEntries,EhrSfmRecordLifecycle,Merge Record Entries (2 or more instances),Occurs when Record Entries are merged together. - Entries may be merged if duplicate patient records are found.
RI.1.1.19.1,,Evidence of Record Entry Merge Event,Evidence of Record Entry Merge Event,RI.1.1.19.1 Evidence of Record Entry Merge Event,EhrSfmEvidenceOfRecordEntryMergeEvent,EhrSfmMergeRecordEntries,Maintain Evidence of Record Entry Merge Event,"Evidence of Record Entry Merge Event includes key metadata, ensures health record integrity (and trust) and enables record audit."
RI.1.1.20,,Unmerge Record Entries,Unmerge Record Entries,RI.1.1.20 Unmerge Record Entries,EhrSfmUnmergeRecordEntries,EhrSfmRecordLifecycle,Unmerge previously merged Record Entries (2 or more instances),"Occurs when Record Entries must be unmerged from previous merge, as in RI.1.1.16."
RI.1.1.20.1,,Evidence of Record Entry Unmerge Event,Evidence of Record Entry Unmerge Event,RI.1.1.20.1 Evidence of Record Entry Unmerge Event,EhrSfmEvidenceOfRecordEntryUnmergeEvent,EhrSfmUnmergeRecordEntries,Maintain Evidence of Record Entry Unmerge Event,"Evidence of Record Entry Unmerge Event includes key metadata, ensures health record integrity (and trust) and enables record audit."
RI.1.1.21,,Link Record Entries,Link Record Entries,RI.1.1.21 Link Record Entries,EhrSfmLinkRecordEntries,EhrSfmRecordLifecycle,Link Record Entries (2 or more instances),Occurs when Record Entries are linked together. - Entries may be linked for a single an encounter (patient visit)- Entries may be linked for an episode (patient problem)- Entries may be linked for a selected population cohort
RI.1.1.21.1,,Evidence of Record Entry Link Event,Evidence of Record Entry Link Event,RI.1.1.21.1 Evidence of Record Entry Link Event,EhrSfmEvidenceOfRecordEntryLinkEvent,EhrSfmLinkRecordEntries,Maintain Evidence of Record Entry Link Event,"Evidence of Record Entry Link Event includes key metadata, ensures health record integrity (and trust) and enables record audit."
RI.1.1.22,,Unlink Record Entries,Unlink Record Entries,RI.1.1.22 Unlink Record Entries,EhrSfmUnlinkRecordEntries,EhrSfmRecordLifecycle,Unlink previously linked Record Entries (2 or more instances),"Occurs when Record Entries must be unlinked from previous linkage, as in RI.1.1.18."
RI.1.1.22.1,,Evidence of Record Entry Unlink Event,Evidence of Record Entry Unlink Event,RI.1.1.22.1 Evidence of Record Entry Unlink Event,EhrSfmEvidenceOfRecordEntryUnlinkEvent,EhrSfmUnlinkRecordEntries,Maintain Evidence of Record Entry Unlink Event,"Evidence of Record Entry Unlink Event includes key metadata, ensures health record integrity (and trust) and enables record audit."
RI.1.1.23,,Place Record Entries on Legal Hold,Place Record Entries on Legal Hold,RI.1.1.23 Place Record Entries on Legal Hold,EhrSfmPlaceRecordEntriesOnLegalHold,EhrSfmRecordLifecycle,Hold Record Entries in an unaltered state for legal hold period (1 or more instances),Occurs when Record Entries must be marked (and held in an unaltered state) for purposes of a legal hold (typically as the result of court or legal action).
RI.1.1.23.1,,Evidence of Record Entry Legal Hold Event,Evidence of Record Entry Legal Hold Event,RI.1.1.23.1 Evidence of Record Entry Legal Hold Event,EhrSfmEvidenceOfRecordEntryLegalHoldEvent,EhrSfmPlaceRecordEntriesOnLegalHold,Maintain Evidence of Record Entry Legal Hold Event,"Evidence of Record Entry Legal Hold Event includes key metadata, ensures health record integrity (and trust) and enables record audit."
RI.1.1.24,,Release Record Entries from Legal Hold,Release Record Entries from Legal Hold,RI.1.1.24 Release Record Entries from Legal Hold,EhrSfmReleaseRecordEntriesFromLegalHold,EhrSfmRecordLifecycle,Release legal hold on Record Entries (1 or more instances),"Occurs when Record Entries are released from legal hold (previously marked and held in unaltered state), as in RI.1.1.20."
RI.1.1.24.1,,Evidence of Record Entry Legal Hold Removal Event,Evidence of Record Entry Legal Hold Removal Event,RI.1.1.24.1 Evidence of Record Entry Legal Hold Removal Event,EhrSfmEvidenceOfRecordEntryLegalHoldRemovalEvent,EhrSfmReleaseRecordEntriesFromLegalHold,Maintain Evidence of Record Entry Legal Hold Removal Event,"Evidence of Record Entry Legal Hold Removal Event includes key metadata, ensures health record integrity (and trust) and enables record audit."
,,,, ,,,,
RI.1.2,Record Lifespan,,Record Lifespan,RI.1.2 Record Lifespan,EhrSfmRecordLifespan,EhrSfmRecordLifecycleAndLifespan,Manage Record Lifespan,"Record Lifecycle Events (Section RI.1.1) are those required to manage Record Entries in persistent storage over the full course of Record Lifespan (Section RI.1.2). See Section RI.1.1, Record Lifecycle, for further description."
RI.1.2.1,,Manage Record Entries,Manage Record Entries,RI.1.2.1 Manage Record Entries,EhrSfmManageRecordEntries,EhrSfmRecordLifespan,Manage/Persist Record Entries (Multiple instances),"Occurs upon Record Entry origination/retention and thereafter on a continuous and uninterrupted basis for lifespan of each Record Entry.- Ensures long-term retention and preservation of EHR Record Entries, without alteration.Reference: ISO 21089, Section 12.2.2"
RI.1.2.2,,Manage Record Entries for Legal Hold,Manage Record Entries for Legal Hold,RI.1.2.2 Manage Record Entries for Legal Hold,EhrSfmManageRecordEntriesForLegalHold,EhrSfmRecordLifespan,Manage/Preserve Record Entries for Legal Hold (Multiple instances),"Occurs when a set of Record Entries is designated to be held for legal purposes or proceedings. - Ensures preservation of a set of Record Entries for a designated time, held without alteration."
